{
  "schema_version": "1.0",
  "profile_id": "a7ccd6b8-4689-46a5-8099-acbf3ff43384",
  "session_id": "2970fb90-d64f-4315-8450-7d5c38786471",
  "created_at": "2026-05-10T21:03:18.116Z",
  "source_payload": {
    "floor_plan_url": "file:///Users/quamos/Repos/haus/.haus-cache/floor-plans/a2a3a3fe4942f6b982f5333a7b9c70b254ec2c82164872a3bf121f97eff375e6.png",
    "floor_plan_metadata": {
      "source": "local_upload",
      "mime_type": "image/png",
      "size_bytes": 64138,
      "width_px": 448,
      "height_px": 480,
      "sha256": "a2a3a3fe4942f6b982f5333a7b9c70b254ec2c82164872a3bf121f97eff375e6",
      "cache_key": "a2a3a3fe4942f6b982f5333a7b9c70b254ec2c82164872a3bf121f97eff375e6"
    },
    "floor_plan_measurements": {
      "source": "ml_parser",
      "unit": "ft",
      "scale": null,
      "rooms": [
        {
          "room_id": null,
          "name": "Dream",
          "dimensions": {
            "width": 12.5,
            "length": 11.583,
            "area": 144.792
          },
          "unit": "ft",
          "confidence": 0.95
        },
        {
          "room_id": null,
          "name": "Nest",
          "dimensions": {
            "width": 11.917,
            "length": 11.667,
            "area": 139.028
          },
          "unit": "ft",
          "confidence": 0.95
        },
        {
          "room_id": null,
          "name": "Dine",
          "dimensions": {
            "width": 7.833,
            "length": 8,
            "area": 62.667
          },
          "unit": "ft",
          "confidence": 0.95
        }
      ],
      "notes": null
    },
    "pinterest_board_url": "https://www.pinterest.com/tarive22/dark-interior/",
    "brief": "Warm, calm home for a young family that needs a cozy work corner.",
    "objects": [
      "standing_desk",
      "bookshelf"
    ],
    "platform": "all",
    "timestamp": "2026-05-10T21:03:18.113Z",
    "session_id": "2970fb90-d64f-4315-8450-7d5c38786471"
  },
  "aesthetic_profile": {
    "palette": "warm_neutral",
    "lighting": "soft_ambient",
    "density": "layered",
    "style_era": "japandi",
    "dominant_colors": [
      "#0B0B0B",
      "#2F2F2F",
      "#73503A",
      "#D99A48",
      "#8F8F8F"
    ],
    "mood_words": [
      "low-key luxury",
      "calm wabi-sabi",
      "textural warmth",
      "intimate ambient glow",
      "measured minimalism"
    ],
    "pinterest_cluster_labels": [
      "dark minimalist bedroom — black walls + vertical wood slats",
      "moody luxe bedside styling — brass lamps & layered bedding",
      "Japandi noir living room — smoked oak slats, shoji screens & bonsai"
    ],
    "confidence": 0.91
  },
  "pins": [
    {
      "pin_id": "1012465559998726563",
      "source_url": "https://www.pinterest.com/tarive22/dark-interior/",
      "image_url": "https://i.pinimg.com/1200x/7f/df/9e/7fdf9ec235ea3ea3f988f2c8f333e939.jpg",
      "title": "Dark Bedroom with Wooden Touches.",
      "description": "Warm, moody tones meet natural wood for a cozy and elegant bedroom.  #DarkBedroom #WoodDetails #CozyHome",
      "save_count": null,
      "hashtags": [
        "darkbedroom",
        "wooddetails",
        "cozyhome"
      ],
      "cluster_label": "dark minimalist bedroom — black walls + vertical wood slats",
      "selected_for_mood_board": true
    },
    {
      "pin_id": "1012465559998726531",
      "source_url": "https://www.pinterest.com/tarive22/dark-interior/",
      "image_url": "https://i.pinimg.com/1200x/fd/16/07/fd1607ee5737fd4e7e5442e29da17978.jpg",
      "title": "Moody Black Luxe Bedroom — Dark, Cozy & Ultra-Chic 🖤🔥",
      "description": "Bold black tones and gold accents elevate this modern moody bedroom into a luxury retreat. Save this dramatic and elegant look for your dream room inspiration! #moodybedroom #blackbedroomdecor #modernluxestyle",
      "save_count": null,
      "hashtags": [
        "moodybedroom",
        "blackbedroomdecor",
        "modernluxestyle"
      ],
      "cluster_label": "moody luxe bedside styling — brass lamps & layered bedding",
      "selected_for_mood_board": true
    },
    {
      "pin_id": "1012465559998726506",
      "source_url": "https://www.pinterest.com/tarive22/dark-interior/",
      "image_url": "https://i.pinimg.com/1200x/66/44/0f/66440f59643908d20dedfae5765924a0.jpg",
      "title": "Japandi Noir Living Room Ideas: Dark Minimal Decor with Black Tadelakt & Smoked Oak (2025 Trend)",
      "description": "Discover Japandi Noir: a serene, moody living room with matte black tadelakt walls, smoked oak slats, a charcoal linen sectional, and a monolithic black stone coffee table. Warm gray microcement floors, frosted shoji screens, a single bonsai, and soft skylight glow deliver calm, textural minimalism. Save for dark interior design ideas, modern wabi-sabi styling, and Scandinavian–Japanese living room inspiration.",
      "save_count": null,
      "hashtags": [],
      "cluster_label": "Japandi noir living room — smoked oak slats, shoji screens & bonsai",
      "selected_for_mood_board": true
    }
  ],
  "cluster_summary": [
    {
      "label": "dark minimalist bedroom — black walls + vertical wood slats",
      "pin_ids": [
        "1012465559998726563"
      ],
      "visual_notes": "Matte black walls and ceiling, vertical walnut/smoked oak slat accent, low wood platform bed and matching nightstands, charcoal linens, thin pendant lights and warm cove LED. Stage with a single small plant, minimal bedside objects, and expansive glazing to balance heaviness.",
      "weight": 0.34
    },
    {
      "label": "moody luxe bedside styling — brass lamps & layered bedding",
      "pin_ids": [
        "1012465559998726531"
      ],
      "visual_notes": "Upholstered dark headboard, layered neutrals (light gray sheets + charcoal duvet), sculptural brass dome bedside lamps, floating shelves with curated ceramics/art, recessed LED strip behind ribbed panel. Stage with textured throws and 1–2 sculptural metallic accents for warmth.",
      "weight": 0.33
    },
    {
      "label": "Japandi noir living room — smoked oak slats, shoji screens & bonsai",
      "pin_ids": [
        "1012465559998726506"
      ],
      "visual_notes": "Matte black tadelakt or painted walls, smoked oak vertical slats, low charcoal linen sectional, monolithic black marble coffee table, frosted shoji screens and a single bonsai for organic focus. Stage with a neutral woven rug, low clutter, and tactile cushions to emphasize calm minimalism.",
      "weight": 0.33
    }
  ],
  "floor_plan": {
    "rooms": [
      {
        "room_id": "nest_living_room",
        "name": "Nest",
        "room_type": "living_room",
        "area_estimate": "medium",
        "measured_dimensions": {
          "width": 11.917,
          "length": 11.667,
          "area": 139.028
        },
        "measured_unit": "ft",
        "windows": "bay window / large glazed opening toward relax area",
        "natural_light": "high",
        "adjoins": [
          "dine_dining_room",
          "taste_kitchen",
          "dream_bedroom"
        ],
        "generation_priority": 1
      },
      {
        "room_id": "dream_bedroom",
        "name": "Dream",
        "room_type": "bedroom",
        "area_estimate": "medium",
        "measured_dimensions": {
          "width": 12.5,
          "length": 11.583,
          "area": 144.792
        },
        "measured_unit": "ft",
        "windows": "single exterior window on top wall",
        "natural_light": "medium",
        "adjoins": [
          "revive_bathroom",
          "nest_living_room"
        ],
        "generation_priority": 2
      },
      {
        "room_id": "taste_kitchen",
        "name": "Taste",
        "room_type": "kitchen",
        "area_estimate": "small",
        "measured_dimensions": null,
        "measured_unit": null,
        "windows": "small window/vent above counter (adjacent exterior wall)",
        "natural_light": "medium",
        "adjoins": [
          "nest_living_room",
          "dine_dining_room",
          "revive_bathroom"
        ],
        "generation_priority": 3
      },
      {
        "room_id": "dine_dining_room",
        "name": "Dine",
        "room_type": "dining_room",
        "area_estimate": "small",
        "measured_dimensions": {
          "width": 7.833,
          "length": 8,
          "area": 62.667
        },
        "measured_unit": "ft",
        "windows": "bay-style multi-pane window on exterior corner",
        "natural_light": "high",
        "adjoins": [
          "nest_living_room",
          "taste_kitchen"
        ],
        "generation_priority": 4
      },
      {
        "room_id": "revive_bathroom",
        "name": "Revive",
        "room_type": "bathroom",
        "area_estimate": "small",
        "measured_dimensions": null,
        "measured_unit": null,
        "windows": "small frosted window near tub",
        "natural_light": "low",
        "adjoins": [
          "dream_bedroom",
          "taste_kitchen"
        ],
        "generation_priority": 5
      }
    ],
    "total_rooms": 5,
    "layout_type": "open_plan",
    "confidence": 0.85,
    "notes": "Used ML-provided measurements for Dream, Nest, and Dine. Other room sizes estimated; excluded service/circulation spaces per instructions."
  },
  "provenance": {
    "pinterest": {
      "provider": "apify",
      "requested_limit": 10,
      "returned_count": 3,
      "actor_id": "fatihtahta~pinterest-scraper-search"
    },
    "models": {
      "aesthetic_extraction": "gpt-5-mini",
      "floor_plan_parsing": "gpt-5-mini"
    }
  },
  "warnings": []
}
